{
  "ip_id": "01ARZ3NDEKTSV4RRFFQ69G5FAH",
  "project_id": "01ARZ3NDEKTSV4RRFFQ69G5FAV",
  "type": "patent",
  "title": "Method for optimizing statistical analysis in small-sample datasets",
  "description": "Novel statistical technique combining Bayesian inference with bootstrap resampling",
  "status": "filed",
  "filing_date": "2026-03-15",
  "publication_date": "2026-06-15",
  "grant_date": "2026-12-15",
  "filing_number": "PCT/KR2026/003456",
  "registration_number": "KR10-2026-0034567",
  "jurisdiction": ["KR", "US", "EP"],
  "inventors": ["01ARZ3NDEKTSV4RRFFQ69G5FB5", "01ARZ3NDEKTSV4RRFFQ69G5FB6"],
  "related_artifact_ids": ["01ARZ3NDEKTSV4RRFFQ69G5FAF"],
  "notes": "Co-invention with TIPA institute; commercialization strategy pending",
  "created_at": "2026-03-15T10:00:00Z",
  "updated_at": "2026-04-10T15:30:00Z"
}
